Atlantic Coast Pipeline Canceled as Delays and Costs Mount;7
Warren Buffett Is Back in the Game;7
Jack Ma Quits SoftBank;5
Warren Buffett Isn’t Buying Anything;5
Warren Buffett’s Optimistic? Pessimistic? No, Realistic;5
Warren Buffett Will Sell His Newspaper Empire;1
The Flaw in Warren Buffett’s Estate Plan;2
Warren Buffett Praises Performance, but Offers No Surprises in Annual Letter;2
The Most Popular Properties of April;5
The Most Popular Properties of March;4
Candace Vickery, Kimberly Rose;1
The business news to watch in the week ahead.;8
Warren Buffett Has a Problem With ‘Independent’ Directors;2
Tom Steyer Exaggerates Fossil Fuel Divestment;1
Tesla is joining the S&P 500, and that could have investors scrambling to buy its shares.;11
Homes That Sold for Around $625,000;10
Homes That Sold for Around $600,000;8
Homes That Sold for Around $750,000;2
Homes That Sold for Around $750,000;11
Homes That Sold for Around $600,000;6
Homes That Sold for Around $750,000;10
Homes That Sold for Around $750,000;4
Homes That Sold for Around $600,000;12
Homes That Sold for Around $750,000;6
Homes That Sold for Around $750,000;5
Homes That Sold for Around $750,000;3
Marrying a Guy Who Cheers Your Career;11
Homes That Sold for Around $1 Million;7
Homes That Sold for Around $1 Million;6
Homes That Sold for Around $450,000;12
Homes That Sold for Around $575,000;9
Homes That Sold for Around $1.25 Million;7
Homes That Sold for Around $1.5 Million;1
Homes That Sold for Around $1 Million;12
Homes That Sold for Around $450,000;3
J.C. Penney Files for Bankruptcy Protection;5
Jeff Bezos Doubles Down on Amazon’s Pandemic Response;5
Facebook’s Big Meeting Didn’t Go So Well;7
A Media Critic Focuses on the Crisis in Local News;7
Infections Rise, Earnings Fall, Stocks Go ... Up?;7
Going ‘Full Suburb’: An Upsizing Couple Leave Brooklyn for New Jersey. Which of These Houses Did They Choose?;11
TikTok Makes a Deal (Not That One);8
3 Major U.S. Airlines Suspend China Flights Over Coronavirus;1
The Mystery of High Stock Prices;7
Help! A Hurricane Destroyed Our House and We Can’t Afford That Vacation Anymore;1
Elon Musk Hits Back at Critics;1
We Will Always Have Avarice;4
How 2 Labor Dept. Rules Can Undermine Your Retirement Plans;8
Snowflake More Than Doubles in Debut as Wall Street Embraces Tech IPOs;9
$350,000 Homes in Connecticut, Michigan and Texas;2
$350,000 Homes in Connecticut, Michigan and Texas;2
How Amazon, Geico and Walmart Fund Propaganda;1
A Challenge to Real Estate Commissions Gains Ground;10
$375,000 Homes in Pennsylvania, Vermont and Texas;10
$1.5 Million Homes in Florida, Illinois and California;4
$1.4 Million Homes in California;1
Yes, Fake News Is a Problem. But There’s a Real News Problem, Too.;7
$450,000 Homes in New York, Kansas and Florida;6
Happy Results Turned Up Everywhere You Looked;1
Travis Scott Meets McDonald’s (It’s Lit!);9
Businesses Are Supposed to Cut Debt in a Downturn. Why Not Now?;7
Real Estate Agents Return to Work as City Reopens;6
Want to Live Near the Shore? Here Are Six Emerging Areas;11
Apple’s Trillions;8
$1.2 Million Homes in California;3
$2.6 Million Homes in California;10
Virtual Tours Are Here to Stay. This Is How to Do Them Right.;9
Tropical Breezes, Pristine Beaches and a Domain Name to Die For;2
$950,000 Homes in New York, Utah and Pennsylvania;8
Virus, Confederate Flag, Amy Cooper: Your Monday Evening Briefing;7
A Big Bet That May Not Be Enough;3
$2.9 Million Homes in California;1
$1.3 Million Homes in Pennsylvania, Colorado and Texas;11
$990,000 Homes in California;9
Apple Reaches $2 Trillion, Punctuating Big Tech’s Grip;8
$5 Million Homes in New York, the District of Columbia and Michigan;8
$2 Million Homes in Pennsylvania, New York and New Orleans;3
$1.4 Million Homes in Connecticut, New York and South Carolina;9
$1 Million Homes in South Dakota, Illinois and Rhode Island;1
$3.7 Million Homes in California;8
$1.8 Million Homes in California;4
$3 Million Homes in California;4
Tesla, Profitable at Last, Bulls Its Way Into the S&P 500;12
Should C.E.O.s Keep Speaking Out?;11
After the Market’s Worst Day in Decades, Where Do We Go From Here?;3
Bloomberg’s Bruising Debate Dents His Odds;2
Away’s Once and Future C.E.O.;1
Your Thursday Briefing;7
Trump and Biden Will Fight the Election With Charts;5
The World Isn’t Ready for a Major Coronavirus Outbreak;2
Some Companies Seeking Bailouts Had Piles of Cash, Then Spent It;4
Verona, N.J.: A Hilly Suburb Where You Can Stretch Your Budget;3
What You Need to Know Now About Travel Insurance;11
Trouble Ahead: More Deals Are Falling Apart;5
Exclusive Details on Michael Bloomberg’s Plan to Rein In Wall Street;2
$2.4 Million Homes in California;7
$4 Million Homes in California;5
‘It’s Going to Be a Bit of a Bumpy Ride’: Financiers Weigh In on the Crisis;5
$3 Million Homes in Florida, New York and Virginia;12
East Fishkill, N.Y.: Close to the City, but Far Enough Away;2
Jackson Township, N.J.: A Range of Housing With ‘Tremendous Value’;11
Pawling, N.Y.: A Quaint Place With Acres of Open Space;9
The Next Energy Battle: Renewables vs. Natural Gas;7
Fired in a Pandemic ‘Because We Tried to Start a Union,’ Workers Say;4
Bill Gates Sr., Who Guided Billionaire Son’s Philanthropy, Dies at 94;9
Big Finance, Big Tech and Joe Biden;8
Say One Thing, Donate to Another;7
Manhattan Faces a Reckoning if Working From Home Becomes the Norm;5
What Would Microsoft Do With TikTok?;8
Looking for a Place to Golf in Retirement? Expand Your Horizons;3
Steven Cohen’s Redemption Tour;8
To Many Travelers, 2020 Was the Summer of 1965;9
5 Ways the Coronavirus Has Changed Suburban Real Estate;7
Coronavirus Escape: To the Suburbs;5
There’s Covid in the Office. Who Should Know?;9
What if There Isn’t a Vaccine for Years?;9
Stocks Waver as China Tensions Climb;5
‘Evil Genuises,’ by Kurt Andersen: An Excerpt;8
Leaving New York: How to Choose the Right Suburb;8
Relaxed Rules and Warm Weather Test States;5
Faces of Power: 80% Are White, Even as U.S. Becomes More Diverse;9
