What Happens When Americans Join the Global Internet;9
When Is a Deal Not a Deal?;9
TikTok Deal Trips Over U.S.-China Power Struggle;9
‘There’s No There There’: What the TikTok Deal Achieved;9
Trump Approves Deal Between Oracle and TikTok;9
A New Spin on SPACs;9
Walmart Announces Membership Service in Attempt to Compete With Amazon;9
Officer Charged in Fatal Shooting of a Black Man in a California Walmart;9
Why Does Walmart Want TikTok? Looking to China May Explain;8
TikTok Deal Faces Complications as U.S. and China Ratchet Up Tit-for-Tat;8
The Time for TikTok’s Talks Is Ticking Down;8
TikTok Is Said to Wrestle With Two Competing Offers;8
Big-Box Retailers’ Profits Surge as Pandemic Marches On;8
Meet the New C.D.C. Director: Walmart;7
Walmart, Nation’s Largest Retailer, Will Require Customers to Wear Masks;7
Salmonella Cases Linked to Onions Increase to Nearly 900;8
A Wrinkle in Stores’ Mask Policies: Enforcement;7
A Close Look at a Fashion Supply Chain Is Not Pretty;7
2 Dead in Shooting at Walmart Distribution Center in California, Including Gunman;6
How to Sell Books in 2020: Put Them Near the Toilet Paper;7
A Company Backs a Cause. It Funds a Politician Who Doesn’t. What Gives?;7
Police Investigating the Release of Bedbugs at a Walmart;1
Say One Thing, Donate to Another;7
Walmart Says It Will No Longer Lock Up African-American Beauty Products;6
Walmart Says It’s Not Lowering Forecast Because of Coronavirus;2
Walmart will raise wages for 165,000 employees.;9
At Walmart, the Coronavirus Makes It Feel Like Black Friday;3
Walmart, Uber and Others Tweak Sick-Leave Policies as Coronavirus Spreads;3
David Glass, Walmart Boss and K.C. Royals Owner, Dies at 84;1
2 Police Officers Injured in Shooting at Walmart in Arkansas, Officials Say;2
How Amazon, Geico and Walmart Fund Propaganda;1
McDonald’s Joins Walmart and Dozens of Other Chains With Mask Mandates;7
Here’s What Companies Are Promising to Do to Fight Racism;6
Retailers, Battered by Pandemic, Now Confront Protests;6
Big Pharmacy Chains Also Fed the Opioid Epidemic, Court Filing Says;5
Amazon Angles to Grab Back Customers;5
What Role Should Employers Play in Testing Workers?;5
For Most Food Stamp Users, Online Shopping Isn’t an Option;5
As Amazon Rises, So Does the Opposition;4
Retailers Under Growing Pressure to Let Workers Wear Masks;4
Help Wanted: Grocery Stores, Pizza Chains and Amazon Are Hiring;3
Should Robots Have a Face?;2
Americans Keep Clicking to Buy, Minting New Online Shopping Winners;5
Retailers have strong rules on masks, but weak enforcement.;7
The Week in Business: TikTok’s Last-Minute Save;9
How retailers aimed to avoid being superspreaders.;11
Federal Hate Crime Charges Filed in El Paso Shooting That Targeted Latinos;2
President Trump says China must cede control of TikTok or he ‘won’t make the deal.’;9
We Need Amazon During the Coronavirus. That’s a Problem.;3
A flurry of activity suggests that deal-making isn’t dead.;7
‘There Is Plenty of Food in the Country’;3
A Lifetime of Seeing the Good and the Bad Between Neighbors;8
The Companies Putting Profits Ahead of Public Health;3
Big Tech Should Try Radical Candor;12
As Deadline Lapses, Trump Administration Continues TikTok Talks;12
The Amazon Prime Day Deals Worth Buying;10
When Art Begins at the Scene of a Crime;1
Is There Really a Toilet Paper Shortage?;3
Tit for Tat for TikTok;9
Trump’s supporters in Pennsylvania echo his misinformation on the virus.;10
A look at Douglas Emhoff’s legal career as he seeks to become the nation’s first Second Gentleman.;9
Horchata Ice Cream in a Store Near You;8
Soccer Coach in El Paso Shooting Dies 9 Months Later;4
The Week in Business: The Bitter End;12
C.E.O.s call for more aid for small businesses.;8
The Latino Vote: The ‘Sleeping Giant’ Awakens;3
The pandemic is accelerating a change to change (the coin kind).;11
What we overheard on earnings calls.;8
Welcome to India, Mr. Bezos. Here’s an Antitrust Complaint.;1
C.E.O.s set goals to advance racial equity by providing money and mentorship.;10
Trump Supports Washington Team Name. Retailers Pull Merchandise.;7
Migrant Workers Restricted to Farms Under One Grower’s Virus Lockdown;10
Amazon workers call for a day off to vote.;10
When Stocking Grocery Shelves Turns Dangerous;3
Best Buy to join retailers paying a $15 minimum wage.;7
Bagged Salads Recalled After Hundreds Are Sickened in the Midwest;6
When Amazon Flexes Its Power;6
Trailing Women With a Camera Was Legal, Appeals Court Rules;5
L.G.B.T.Q. Rights Ruling Pushes Workplace Dynamic Already in Motion;6
What Happened to the Great American Logistics Machine?;5
U.S. Stocks Have Their Best Month Since 1987;4
The retail industry’s tumultuous year began before the pandemic.;12
The Mint has a plea for Americans: Change in your coins.;7
‘Where Do I Find Your Hand Sanitizer?’ Sorry, We Have None.;2
Amazon Misses a Shopping Opportunity;5
The Tech Giants’ Invisible Helpers;7
Santas have Covid concerns, too: How retailers are preparing for the holidays.;9
Curbside pickup is another innovation that is likely to outlast the pandemic.;10
Raised in a (Very) Crowded House, Now Feeding the Hungry in a Pandemic;6
‘Console Wars’ Review: In Nintendo vs. Sega, Mortals Combat;9
Payout From a National Opioids Settlement Won’t Be as Big as Hoped;2
Down to one job, she worries about money and a child’s health.;11
Online sales fuel retailers across the country.;8
Women’s Unpaid Labor is Worth $10,900,000,000,000;3
The Week in Business: Twitter’s Mystery Hackers;7
There’s a Giant Hole in Pelosi’s Coronavirus Bill;3
The Disastrous Employment Numbers Show Almost Every Job Is at Risk;5
Andy Rubin’s Start-Up, Essential Products, Shuts Down;2
The Week in Business: It’ll Get Worse Before It Gets Better;3
City That Once Guided a Nation Now Shows Its Cracks;7
Doug Emhoff, Kamala Harris’s husband, takes a leave of absence from his law firm.;8
To keep up with pandemic boom in online shopping, Amazon hired 427,300 employees in 10 months.;11
Making the Most of Staying at Home;4
6 Items to Stuff in Your Ski Jacket Pockets;1
What to Bring on Vacation if You Want to Learn How to Surf;3
Private Tutors, Pop-Up Schools or Nothing at All: How Employers Are Helping Parents;9
Within Days, Florida Family Loses Two Siblings, 20 and 22, to the Virus;7
Never Mind the Internet. Here’s What’s Killing Malls.;2
5 Things to Avoid on Prime Day;9
How Climate Policy Will Change in 2021;12
Center Stage at Disney After a Career Out of the Spotlight;2
What Is Going On?;8
After Factory Disaster, Bangladesh Made Big Safety Strides. Are the Bad Days Coming Back?;3
We Have Questions;7
Marc Benioff’s $25 Million Blitz to Buy Protective Gear From China;4
How Ginsburg’s Successor Could Remake Business;9
Amazon workers threaten to shut down warehouses if employees don’t get a day off to vote.;10
Corrections: June 14, 2020;6
News Quiz: Coronavirus, Remdesivir, Bill de Blasio;5
The Place Hit Hardest by the Virus;12
Dave Chappelle’s Netflix Special: Three Key References to Know;6
The TV Commercial, Once Advertising’s Main Event, Suffers in the Pandemic;5
Adrian Gomez, Who Cared for Migrant Youth, Is Dead at 52;7
Pushed by Pandemic, Amazon Goes on a Hiring Spree Without Equal;11
Who Is Derrick Brown? A Leader Who Isn’t Defined by Football;4
Migrant farmworkers under lockdown say restrictions severely limit their freedom.;10
‘Tough Day for Us at Twitter’;7
You Can’t Escape Uber’s Lobbying;10
With Steve King Gone, Does the Democrat Have a Shot in His Iowa District?;6
Stocks Rise After Trump Reaffirms China Trade Deal: Live Updates;6
Lord & Taylor Files for Bankruptcy as Retail Collapses Pile Up;8
U.S. Appeals Injunction Against TikTok Ban;10
10 Racehorses Killed in Fiery Crash on New Jersey Turnpike;6
Jacob Soboroff Saw Kids in Cages. Then He Started Talking — and Writing.;7
Man Faces Terrorism Charge After Threatening to Kill Michigan’s Governor, Officials Say;5
A Steal Might Actually Be a Raw Deal;8
Even in a Pandemic, the Billionaires Are Winning;11
Three New Memoirs Bring the Farm to the Page;6
Facebook and Its Secret Policies;5
Online Shopping Is Amazing. Or Is It?;12
‘You’re On Your Own,’ Essential Workers Are Being Told;4
YoungBoy Never Broke Again Earns a Third No. 1 Album in a Year;9
Lesson of the Day: ‘Coronavirus Cost to Businesses and Workers: “It Has All Gone to Hell”’;3
U.S. Appeals Injunction Against WeChat Ban;10
Former Bumble Bee C.E.O. Is Sentenced in Tuna Price-Fixing Scheme;6
Church That Defied Coronavirus Restrictions Is Burned to Ground;5
Roommates in Coronavirus Era: ‘Friends’ It Isn’t;4
As Concerns Over Climate Change Rise, More Developers Turn to Wood;9
Panicked Shoppers Empty Shelves as Coronavirus Anxiety Rises;3
Stop. Don’t Share That Election Rumor.;11
Labor Fight Collides With the Pandemic at Trader Joe’s;4
SARS Stung the Global Economy. The Coronavirus Is a Greater Menace.;2
As the U.S. vaccine drive lags, a fast-moving coronavirus variant reaches a second state.;12
Google Takes Aim at Amazon. Again.;7
American Workers Deserve to Live With Dignity;6
Fairway Is So Crowded! How Can It Be in Bankruptcy?;1
Boarded-Up Windows and Increased Security: Retailers Brace for the Election;10
Macy’s Plans to Reopen All of Its 775 Stores in 6 to 8 Weeks;4
Is It Immoral to Increase the Price of Goods During a Crisis?;3
What to Cook This Weekend;7
F.D.A. Authorizes First In-Home Test for Coronavirus;4
‘How to Load a Musket’ Review: A Play About Re-enactors Gets Real;1
Harrison Johnson, Pastor at Funeral in Mass Shooting, Dies at 65;10
Wall St. Caps a Turbulent Week With a Decline;4
Families Scramble to Find Baby Formula, Diapers and Wipes;3
‘It’s Just Crazy’ in Pennsylvania: Mail Voting and the Anxiety That Followed;11
Reliable Amazon Isn’t Anymore;4
Unions Push F.T.C. to Study if Amazon Warps the Economy;2
Splitting 5-4, Supreme Court Grants Alabama’s Request to Restore Voting Restrictions;7
Macy’s Damage Is Limited, but Looting Deals a Symbolic Blow;6
The Workers Who Face the Greatest Coronavirus Risk;3
What to Cook This Week;2
Second Chance for First Impression;6
Major Retailers in Britain Say No to Glitter for Christmas;10
U.S. Officials Say Covid-19 Vaccination Effort Has Lagged;12
The Week in Business: Getting Vaccines From Here to There;12
Hate Crimes in U.S. Rose to Highest Level in More Than a Decade in 2019;11
In a Deadly Start to 2020, Gunfire Erupts Across America;1
Sharon Williams, a Nurturer on the Police Force, Dies at 54;8
Review: ‘After Truth,’ the Deluge;3
